{
  "taskId": "task_operational_review",
  "status": "completed",
  "summary": "The strongest candidate organizes materials around events, evidence links, and review dependencies.",
  "outputs": [
    {
      "artifactId": "artifact_review_graph",
      "kind": "review-graph",
      "title": "Operational Review Graph"
    }
  ],
  "scores": {
    "confidence": 0.81,
    "completeness": 0.77
  }
}
